{
  "id": "SRC-AWS-UNTC",
  "name": "United Nations Treaty Collection",
  "publisher": "United Nations",
  "authority_role": "OFFICIAL_DEPOSITARY",
  "canonical_url": "https://treaties.un.org/",
  "scope": [
    "multilateral_treaties",
    "depositary_status",
    "treaty_actions",
    "certified_true_copies"
  ],
  "retrieved_at": "2026-09-07T22:56:43Z",
  "notes": "Official UN treaty/depositary system. Phase 3A provides a hardened live status adapter for selected instruments; broad catalog polling and depositary-notification ingestion remain later scope."
}
